{
  "packageVersion": "1",
  "blockHash": "0xaaaaaaaaaaaaaaaaaaaaaaaaaaaaaaaaaaaaaaaaaaaaaaaaaaaaaaaaaaaaaaaa",
  "contentHash": "0xbbbbbbbbbbbbbbbbbbbbbbbbbbbbbbbbbbbbbbbbbbbbbbbbbbbbbbbbbbbbbbbb",
  "blockCid": "bafybeigdyrzt5sfp7udm7hu76uh7y26nf3efuylqabf3ocl5t3u7z5e2aa",
  "contentCid": "bafybeigdyrzt5sfp7udm7hu76uh7y26nf3efuylqabf3ocl5t3u7z5e2ab",
  "parents": []
}
