{
  "packageVersion": "1",
  "blockHash": "0xaaaaaaaaaaaaaaaaaaaaaaaaaaaaaaaaaaaaaaaaaaaaaaaaaaaaaaaaaaaaaaaa",
  "contentHash": "0xbbbbbbbbbbbbbbbbbbbbbbbbbbbbbbbbbbbbbbbbbbbbbbbbbbbbbbbbbbbbbbbb",
  "blockCid": "QmYwAPJzv5CZsnAzt8auVTLx4mP2MPrn1YxGs1D9fQdM4f",
  "contentCid": "bafybeigdyrzt5sfp7udm7hu76uh7y26nf3efuylqabf3ocl5t3u7z5e2ab",
  "parents": [
    {
      "blockHash": "0xcccccccccccccccccccccccccccccccccccccccccccccccccccccccccccccccc",
      "cid": "bafybeigdyrzt5sfp7udm7hu76uh7y26nf3efuylqabf3ocl5t3u7z5e2ac"
    }
  ]
}
